Name,DOB,BattingStyle,ICCRanking,IntDebut,Profile,CaptainStatus,PlayerRole
Shakib Al Hasan,1987-03-24,Left-handed,1,2006-08-06,An all-rounder known for his versatility,false,All-Rounder
Tamim Iqbal,1989-03-20,Left-handed,15,2007-02-09,A prominent opener for Bangladesh,true,Opening Batsman
Mushfiqur Rahim,1987-09-09,Right-handed,12,2005-05-26,Key middle-order batsman and wicketkeeper,false,Wicketkeeper-Batsman
Litton Das,1994-10-13,Right-handed,16,2015-06-10,An aggressive top-order batsman,false,Batsman
Taskin Ahmed,1995-04-03,Right-handed,21,2014-04-01,Fast bowler with consistent pace,false,Fast Bowler
